{
    "$schema": "https://raw.githubusercontent.com/HUPO-PSI/mzSpecLib/master/specification/peak-annotation-format/annotation-schema.json",
    "neutral_losses": [],
    "isotope": 0,
    "adducts": [],
    "charge": 1,
    "analyte_reference": 1,
    "mass_error": {
        "value": -1.7,
        "unit": "ppm"
    },
    "confidence": null,
    "molecule_description": {
        "series_label": "precursor"
    }
}
